{
  "id": "ind:hc:mylotarg:0",
  "type": "Indication",
  "description": "Mylotarg (gemtuzumab ozogamicin for injection) is indicated for combination therapy with daunorubicin (DNR) and cytarabine (AraC) for the treatment of patients with previously untreated, de novo CD33-positive acute myeloid leukemia (AML), except acute promyelocytic leukemia.",
  "contributions": [
    {
      "id": "ctrb:vanallenlab:2024-10-30:0",
      "type": "Contribution",
      "description": "Initial access of FDA approvals",
      "date": "2024-10-30",
      "contributor": {
        "id": "agent:user:vanallenlab",
        "type": "Agent",
        "agentType": "contributor",
        "name": "Van Allen lab",
        "description": "Van Allen lab, Dana-Farber Cancer Institute"
      }
    }
  ],
  "reportedIn": [
    {
      "id": "doc:hc:mylotarg",
      "type": "Document",
      "documentType": "Regulatory approval",
      "name": "Mylotarg (gemtuzumab ozogamicin) [product monograph]. HC.",
      "title": null,
      "aliases": [],
      "description": "Pfizer Canada ULC. Mylotarg (gemtuzumab ozogamicin) [product monograph]. Health Canada website. https://pdf.hres.ca/dpd_pm/00069427.PDF. Revised February 2023. Accessed June 2025.",
      "urls": [
        "https://pdf.hres.ca/dpd_pm/00069427.PDF",
        "https://health-products.canada.ca/dpd-bdpp/info?lang=eng&code=98440"
      ],
      "doi": null,
      "pmid": null,
      "extensions": [
        {
          "name": "agent",
          "value": {
            "id": "agent:org:hc",
            "type": "Agent",
            "agentType": "organization",
            "name": "Health Canada",
            "description": "Regulatory agency that approves drugs for sale and use in Canada."
          },
          "description": "The organization that published this document."
        },
        {
          "name": "company",
          "value": "Pfizer Canada ULC",
          "description": "The company that manufactures the cancer drug. Only applicable to market authorization documents."
        },
        {
          "name": "drug_name_brand",
          "value": "Mylotarg",
          "description": "The brand name of the cancer drug, per this document. Only applicable to market authorization documents."
        },
        {
          "name": "drug_name_generic",
          "value": "gemtuzumab ozogamicin",
          "description": "The generic name of the cancer drug, per this document. Only applicable to market authorization documents."
        },
        {
          "name": "first_publication_date",
          "value": "2019-11-28",
          "description": "The publication date for the initial version of this document."
        },
        {
          "name": "publication_date",
          "value": "2023-02-02",
          "description": "The publication date for the document."
        },
        {
          "name": "regulatory_identifier",
          "value": null,
          "description": "Identifier assigned by the regulatory agency, such as an FDA application number (e.g. NDA208716, BLA125427) or an EMA product number (e.g. EMEA/H/C/006184)."
        },
        {
          "name": "status",
          "value": "Active",
          "description": "Whether this document is Active or Deprecated within moalmanac-db."
        }
      ]
    }
  ],
  "extensions": [
    {
      "name": "status",
      "value": "Approved",
      "description": "Current approval status."
    }
  ]
}