{
  "id": "ind:ema:alunbrig:1",
  "type": "Indication",
  "description": "Alunbrig is indicated as monotherapy for the treatment of adult patients with ALK-positive advanced NSCLC previously treated with crizotinib.",
  "contributions": [
    {
      "id": "ctrb:vanallenlab:2024-10-20:0",
      "type": "Contribution",
      "description": "Adding EMA approvals for use to database",
      "date": "2024-10-20",
      "contributor": {
        "id": "agent:user:vanallenlab",
        "type": "Agent",
        "agentType": "contributor",
        "name": "Van Allen lab",
        "description": "Van Allen lab, Dana-Farber Cancer Institute"
      }
    },
    {
      "id": "ctrb:ema:2018-11-22:0",
      "type": "Contribution",
      "description": "Indication received approval from the European Commission.",
      "date": "2018-11-22",
      "contributor": {
        "id": "agent:org:ema",
        "type": "Agent",
        "agentType": "organization",
        "name": "European Medicines Agency",
        "description": "Regulatory agency that approves medicines for use in the European Union."
      }
    }
  ],
  "reportedIn": [
    {
      "id": "doc:ema:alunbrig",
      "type": "Document",
      "documentType": "Regulatory approval",
      "name": "Alunbrig (brigatinib) [product information]. EMA.",
      "title": null,
      "aliases": [],
      "description": "Roche Registration GmbH. Alunbrig (brigatinib) [product information]. European Medicines Agency website. https://www.ema.europa.eu/en/documents/product-information/alunbrig-epar-product-information_en.pdf. Revised September 2023. Accessed March 6, 2024.",
      "urls": [
        "https://www.ema.europa.eu/en/documents/product-information/alunbrig-epar-product-information_en.pdf",
        "https://www.ema.europa.eu/en/medicines/human/EPAR/alunbrig"
      ],
      "doi": null,
      "pmid": null,
      "extensions": [
        {
          "name": "agent",
          "value": {
            "id": "agent:org:ema",
            "type": "Agent",
            "agentType": "organization",
            "name": "European Medicines Agency",
            "description": "Regulatory agency that approves medicines for use in the European Union."
          },
          "description": "The organization that published this document."
        },
        {
          "name": "company",
          "value": "Roche Registration GmbH.",
          "description": "The company that manufactures the cancer drug. Only applicable to market authorization documents."
        },
        {
          "name": "drug_name_brand",
          "value": "Alunbrig",
          "description": "The brand name of the cancer drug, per this document. Only applicable to market authorization documents."
        },
        {
          "name": "drug_name_generic",
          "value": "brigatinib",
          "description": "The generic name of the cancer drug, per this document. Only applicable to market authorization documents."
        },
        {
          "name": "first_publication_date",
          "value": "2018-11-26",
          "description": "The publication date for the initial version of this document."
        },
        {
          "name": "publication_date",
          "value": "2023-09-22",
          "description": "The publication date for the document."
        },
        {
          "name": "regulatory_identifier",
          "value": null,
          "description": "Identifier assigned by the regulatory agency, such as an FDA application number (e.g. NDA208716, BLA125427) or an EMA product number (e.g. EMEA/H/C/006184)."
        },
        {
          "name": "status",
          "value": "Active",
          "description": "Whether this document is Active or Deprecated within moalmanac-db."
        }
      ]
    }
  ],
  "extensions": [
    {
      "name": "status",
      "value": "Approved",
      "description": "Current approval status."
    }
  ]
}