{
  "id": "ind:fda:jemperli:0",
  "type": "Indication",
  "description": "JEMPERLI is a programmed death receptor-1 (PD-1)-blocking antibody indicated in combination with carboplatin and paclitaxel, followed by JEMPERLI as a single agent for the treatment of adult patients with primary advanced or recurrent endometrial cancer that is mismatch repair deficient (dMMR), as determined by an FDA-approved test, or microstallite instability-high (MSI-H).",
  "contributions": [
    {
      "id": "ctrb:vanallenlab:2024-10-30:0",
      "type": "Contribution",
      "description": "Initial access of FDA approvals",
      "date": "2024-10-30",
      "contributor": {
        "id": "agent:user:vanallenlab",
        "type": "Agent",
        "agentType": "contributor",
        "name": "Van Allen lab",
        "description": "Van Allen lab, Dana-Farber Cancer Institute"
      }
    },
    {
      "id": "ctrb:fda:2023-07-31:0",
      "type": "Contribution",
      "description": "Indication received traditional approval.",
      "date": "2023-07-31",
      "contributor": {
        "id": "agent:org:fda",
        "type": "Agent",
        "agentType": "organization",
        "name": "Food and Drug Administration",
        "description": "Regulatory agency that approves drugs for use in the United States."
      }
    }
  ],
  "reportedIn": [
    {
      "id": "doc:fda:jemperli",
      "type": "Document",
      "documentType": "Regulatory approval",
      "name": "Jemperli (dostarlimab) [package insert]. FDA.",
      "title": null,
      "aliases": [],
      "description": "GlaxoSmithKline LLC. Jemperli (dostarlimab) [package insert]. U.S. Food and Drug Administration website. https://www.accessdata.fda.gov/drugsatfda_docs/label/2024/761174s010lbl.pdf. Revised March 2024. Accessed October 30, 2024.",
      "urls": [
        "https://www.accessdata.fda.gov/drugsatfda_docs/label/2024/761174s010lbl.pdf",
        "https://www.accessdata.fda.gov/scripts/cder/daf/index.cfm?event=overview.process&ApplNo=761174"
      ],
      "doi": null,
      "pmid": null,
      "extensions": [
        {
          "name": "agent",
          "value": {
            "id": "agent:org:fda",
            "type": "Agent",
            "agentType": "organization",
            "name": "Food and Drug Administration",
            "description": "Regulatory agency that approves drugs for use in the United States."
          },
          "description": "The organization that published this document."
        },
        {
          "name": "company",
          "value": "GlaxoSmithKline LLC.",
          "description": "The company that manufactures the cancer drug. Only applicable to market authorization documents."
        },
        {
          "name": "drug_name_brand",
          "value": "Jemperli",
          "description": "The brand name of the cancer drug, per this document. Only applicable to market authorization documents."
        },
        {
          "name": "drug_name_generic",
          "value": "dostarlimab",
          "description": "The generic name of the cancer drug, per this document. Only applicable to market authorization documents."
        },
        {
          "name": "first_publication_date",
          "value": null,
          "description": "The publication date for the initial version of this document."
        },
        {
          "name": "identification_number",
          "value": "BLA761174",
          "description": "Identification number used by the publishing organization."
        },
        {
          "name": "publication_date",
          "value": "2024-03-06",
          "description": "The publication date for the document."
        },
        {
          "name": "status",
          "value": "Active",
          "description": "Whether this document is Active or Deprecated within moalmanac-db."
        }
      ]
    },
    {
      "id": "doc:fda:jemperli:2023-07-31",
      "type": "Document",
      "documentType": "Regulatory approval",
      "name": "Jemperli (dostarlimab) [package insert]. FDA.",
      "title": null,
      "aliases": [],
      "description": "GlaxoSmithKline LLC. Jemperli (dostarlimab) [package insert]. U.S. Food and Drug Administration website. https://www.accessdata.fda.gov/drugsatfda_docs/label/2023/761174s006lbl.pdf. Revised July 2023. Accessed October 6, 2026.",
      "urls": [
        "https://www.accessdata.fda.gov/drugsatfda_docs/label/2023/761174s006lbl.pdf",
        "https://www.accessdata.fda.gov/scripts/cder/daf/index.cfm?event=overview.process&ApplNo=761174"
      ],
      "doi": null,
      "pmid": null,
      "extensions": [
        {
          "name": "agent",
          "value": {
            "id": "agent:org:fda",
            "type": "Agent",
            "agentType": "organization",
            "name": "Food and Drug Administration",
            "description": "Regulatory agency that approves drugs for use in the United States."
          },
          "description": "The organization that published this document."
        },
        {
          "name": "company",
          "value": "GlaxoSmithKline LLC.",
          "description": "The company that manufactures the cancer drug. Only applicable to market authorization documents."
        },
        {
          "name": "drug_name_brand",
          "value": "Jemperli",
          "description": "The brand name of the cancer drug, per this document. Only applicable to market authorization documents."
        },
        {
          "name": "drug_name_generic",
          "value": "dostarlimab",
          "description": "The generic name of the cancer drug, per this document. Only applicable to market authorization documents."
        },
        {
          "name": "first_publication_date",
          "value": null,
          "description": "The publication date for the initial version of this document."
        },
        {
          "name": "identification_number",
          "value": "BLA761174",
          "description": "Identification number used by the publishing organization."
        },
        {
          "name": "publication_date",
          "value": "2023-07-31",
          "description": "The publication date for the document."
        },
        {
          "name": "status",
          "value": "Deprecated",
          "description": "Whether this document is Active or Deprecated within moalmanac-db."
        }
      ]
    }
  ],
  "extensions": [
    {
      "name": "status",
      "value": "Approved",
      "description": "Current approval status."
    }
  ]
}