{
  "id": "ind:fda:tibsovo:2",
  "type": "Indication",
  "description": "TIBSOVO is an isocitrate dehydrogenase-1 (IDH1) inhibitor indicated for patients with a susceptible IDH1 mutation as detected by an FDA-approved test with for the treatment of adult patients with relapsed or refractory myelodysplastic syndromes.",
  "contributions": [
    {
      "id": "ctrb:vanallenlab:2024-10-30:0",
      "type": "Contribution",
      "description": "Initial access of FDA approvals",
      "date": "2024-10-30",
      "contributor": {
        "id": "agent:user:vanallenlab",
        "type": "Agent",
        "agentType": "contributor",
        "name": "Van Allen lab",
        "description": "Van Allen lab, Dana-Farber Cancer Institute"
      }
    },
    {
      "id": "ctrb:fda:2023-10-24:0",
      "type": "Contribution",
      "description": "Indication received traditional approval.",
      "date": "2023-10-24",
      "contributor": {
        "id": "agent:org:fda",
        "type": "Agent",
        "agentType": "organization",
        "name": "Food and Drug Administration",
        "description": "Regulatory agency that approves drugs for use in the United States."
      }
    }
  ],
  "reportedIn": [
    {
      "id": "doc:fda:tibsovo",
      "type": "Document",
      "documentType": "Regulatory approval",
      "name": "Tibsovo (ivosidenib) [package insert]. FDA.",
      "title": null,
      "aliases": [],
      "description": "Agios Pharmaceuticals, Inc. Tibsovo (ivosidenib) [package insert]. U.S. Food and Drug Administration website. https://www.accessdata.fda.gov/drugsatfda_docs/label/2023/211192s011lbl.pdf. Revised October 2023. Accessed October 30, 2024.",
      "urls": [
        "https://www.accessdata.fda.gov/drugsatfda_docs/label/2023/211192s011lbl.pdf",
        "https://www.accessdata.fda.gov/scripts/cder/daf/index.cfm?event=overview.process&ApplNo=211192"
      ],
      "doi": null,
      "pmid": null,
      "extensions": [
        {
          "name": "agent",
          "value": {
            "id": "agent:org:fda",
            "type": "Agent",
            "agentType": "organization",
            "name": "Food and Drug Administration",
            "description": "Regulatory agency that approves drugs for use in the United States."
          },
          "description": "The organization that published this document."
        },
        {
          "name": "company",
          "value": "Agios Pharmaceuticals, Inc.",
          "description": "The company that manufactures the cancer drug. Only applicable to market authorization documents."
        },
        {
          "name": "drug_name_brand",
          "value": "Tibsovo",
          "description": "The brand name of the cancer drug, per this document. Only applicable to market authorization documents."
        },
        {
          "name": "drug_name_generic",
          "value": "ivosidenib",
          "description": "The generic name of the cancer drug, per this document. Only applicable to market authorization documents."
        },
        {
          "name": "first_publication_date",
          "value": null,
          "description": "The publication date for the initial version of this document."
        },
        {
          "name": "publication_date",
          "value": "2023-10-24",
          "description": "The publication date for the document."
        },
        {
          "name": "regulatory_identifier",
          "value": "NDA211192",
          "description": "Identifier assigned by the regulatory agency, such as an FDA application number (e.g. NDA208716, BLA125427) or an EMA product number (e.g. EMEA/H/C/006184)."
        },
        {
          "name": "status",
          "value": "Active",
          "description": "Whether this document is Active or Deprecated within moalmanac-db."
        }
      ]
    },
    {
      "id": "doc:fda:tibsovo:2023-10-24",
      "type": "Document",
      "documentType": "Regulatory approval",
      "name": "Tibsovo (ivosidenib) [package insert]. FDA.",
      "title": null,
      "aliases": [],
      "description": "Agios Pharmaceuticals, Inc. Tibsovo (ivosidenib) [package insert]. U.S. Food and Drug Administration website. https://www.accessdata.fda.gov/drugsatfda_docs/label/2023/211192s011lbl.pdf. Revised October 2023. Accessed October 6, 2026.",
      "urls": [
        "https://www.accessdata.fda.gov/drugsatfda_docs/label/2023/211192s011lbl.pdf",
        "https://www.accessdata.fda.gov/scripts/cder/daf/index.cfm?event=overview.process&ApplNo=211192"
      ],
      "doi": null,
      "pmid": null,
      "extensions": [
        {
          "name": "agent",
          "value": {
            "id": "agent:org:fda",
            "type": "Agent",
            "agentType": "organization",
            "name": "Food and Drug Administration",
            "description": "Regulatory agency that approves drugs for use in the United States."
          },
          "description": "The organization that published this document."
        },
        {
          "name": "company",
          "value": "Agios Pharmaceuticals, Inc.",
          "description": "The company that manufactures the cancer drug. Only applicable to market authorization documents."
        },
        {
          "name": "drug_name_brand",
          "value": "Tibsovo",
          "description": "The brand name of the cancer drug, per this document. Only applicable to market authorization documents."
        },
        {
          "name": "drug_name_generic",
          "value": "ivosidenib",
          "description": "The generic name of the cancer drug, per this document. Only applicable to market authorization documents."
        },
        {
          "name": "first_publication_date",
          "value": null,
          "description": "The publication date for the initial version of this document."
        },
        {
          "name": "publication_date",
          "value": "2023-10-24",
          "description": "The publication date for the document."
        },
        {
          "name": "regulatory_identifier",
          "value": "NDA211192",
          "description": "Identifier assigned by the regulatory agency, such as an FDA application number (e.g. NDA208716, BLA125427) or an EMA product number (e.g. EMEA/H/C/006184)."
        },
        {
          "name": "status",
          "value": "Deprecated",
          "description": "Whether this document is Active or Deprecated within moalmanac-db."
        }
      ]
    }
  ],
  "extensions": [
    {
      "name": "status",
      "value": "Approved",
      "description": "Current approval status."
    }
  ]
}