{
  "id": "ind:hc:braftovi:0",
  "type": "Indication",
  "description": "BRAFTOVI (encorafenib) is indicated, in combination with binimetinib, for the treatment of patients with unresectable or metastatic melanoma with a BRAF V600 mutation, as detected by a validated test.",
  "contributions": [
    {
      "id": "ctrb:vanallenlab:2024-10-30:0",
      "type": "Contribution",
      "description": "Initial access of FDA approvals",
      "date": "2024-10-30",
      "contributor": {
        "id": "agent:user:vanallenlab",
        "type": "Agent",
        "agentType": "contributor",
        "name": "Van Allen lab",
        "description": "Van Allen lab, Dana-Farber Cancer Institute"
      }
    }
  ],
  "reportedIn": [
    {
      "id": "doc:hc:braftovi",
      "type": "Document",
      "documentType": "Regulatory approval",
      "name": "Braftovi (encorafenib) [product monograph]. HC.",
      "title": null,
      "aliases": [],
      "description": "Pfizer Canada ULC. Braftovi (encorafenib) [product monograph]. Health Canada website. https://pdf.hres.ca/dpd_pm/00081199.PDF. Revised July 2025. Accessed April 2026.",
      "urls": [
        "https://pdf.hres.ca/dpd_pm/00081199.PDF",
        "https://health-products.canada.ca/dpd-bdpp/info?lang=eng&code=100233"
      ],
      "doi": null,
      "pmid": null,
      "extensions": [
        {
          "name": "agent",
          "value": {
            "id": "agent:org:hc",
            "type": "Agent",
            "agentType": "organization",
            "name": "Health Canada",
            "description": "Regulatory agency that approves drugs for sale and use in Canada."
          },
          "description": "The organization that published this document."
        },
        {
          "name": "company",
          "value": "Pfizer Canada ULC",
          "description": "The company that manufactures the cancer drug. Only applicable to market authorization documents."
        },
        {
          "name": "drug_name_brand",
          "value": "Braftovi",
          "description": "The brand name of the cancer drug, per this document. Only applicable to market authorization documents."
        },
        {
          "name": "drug_name_generic",
          "value": "encorafenib",
          "description": "The generic name of the cancer drug, per this document. Only applicable to market authorization documents."
        },
        {
          "name": "first_publication_date",
          "value": "2021-03-02",
          "description": "The publication date for the initial version of this document."
        },
        {
          "name": "publication_date",
          "value": "2025-07-25",
          "description": "The publication date for the document."
        },
        {
          "name": "regulatory_identifier",
          "value": null,
          "description": "Identifier assigned by the regulatory agency, such as an FDA application number (e.g. NDA208716, BLA125427) or an EMA product number (e.g. EMEA/H/C/006184)."
        },
        {
          "name": "status",
          "value": "Active",
          "description": "Whether this document is Active or Deprecated within moalmanac-db."
        }
      ]
    }
  ],
  "extensions": [
    {
      "name": "status",
      "value": "Approved",
      "description": "Current approval status."
    }
  ]
}